{
  "$comment": "Requirement IDs: FAQDEF-01, FAQDEF-02, FAQDEF-03, FAQDEF-RES-02, XCUT-08 | Owned by M14 (DP-D2b §5.2/§5.4) | Judge Q&A defense sheet — anticipated questions tagged to the 4 lablab judging axes (+ optional sponsor slugs), grounded draft answers citing only plan/manifest/PROV sources. Validated via RES-04.",
  "$id": "https://chassis/contracts/faqdef-sheet.schema.json",
  "$schema": "https://json-schema.org/draft/2020-12/schema",
  "title": "FaqdefSheet",
  "description": "FAQDEF-01..03 Q&A defense sheet — questions + tags + grounded answers + allow-list citations; domain enters at runtime only.",
  "type": "object",
  "additionalProperties": false,
  "required": ["version", "generated_at", "question_count", "questions"],
  "properties": {
    "$comment": { "type": "string", "description": "Optional file-header metadata (requirement IDs, provenance); ignored by loaders." },
    "version": {
      "const": "1.0.0",
      "description": "Schema version; additive optional = MINOR."
    },
    "generated_at": { "type": "string", "format": "date-time", "description": "ISO-8601 generation timestamp (UTC)." },
    "question_count": { "type": "integer", "minimum": 5, "maximum": 30, "description": "Number of entries in questions[]; target default 18 per config (FAQDEF-01); post-validator clamps 5..30." },
    "questions": {
      "type": "array",
      "minItems": 1,
      "maxItems": 30,
      "items": {
        "type": "object",
        "additionalProperties": false,
        "required": ["id", "question", "tags", "draft_answer", "citations", "source_grounding"],
        "properties": {
          "id": { "type": "string", "pattern": "^q-(0[1-9]|[12][0-9]|30)$", "description": "Sequential entry id q-01 .. q-30." },
          "question": { "type": "string", "minLength": 20, "maxLength": 400, "description": "Anticipated judge question; derivable from plan/manifest/PROV inputs only (FAQDEF-02)." },
          "tags": {
            "type": "array",
            "minItems": 1,
            "maxItems": 3,
            "uniqueItems": true,
            "items": {
              "oneOf": [
                { "type": "string", "enum": ["presentation", "business_value", "application_of_technology", "originality"], "description": "Fixed lablab judging axis (FAQDEF-01)." },
                { "type": "string", "pattern": "^[a-z0-9]+(-[a-z0-9]+)*$", "not": { "enum": ["presentation", "business_value", "application_of_technology", "originality"] }, "description": "Sponsor-track slug from event_profile.json / frontmatter sponsor_tracks (kebab-case)." }
              ]
            }
          },
          "draft_answer": { "type": "string", "minLength": 80, "maxLength": 600, "description": "Concise defensible answer grounded ONLY in winning_project_plan.md / manifest / PROV disclosure (FAQDEF-03); uncovered figures must use explicit gap form (FAQDEF-RES-02)." },
          "citations": {
            "type": "array",
            "items": {
              "type": "string",
              "pattern": "^(winning_project_plan\\.md|assembly\\.manifest\\.json|disclosure\\.md|event_profile\\.json)(:.+)?$|^not_stated$",
              "description": "Allow-list sources (DP-D2b §5.4): <file>:<heading-or-field> for the four grounded files, or not_stated when nothing is covered."
            }
          },
          "source_grounding": { "type": "string", "enum": ["grounded", "partial", "not_stated"], "description": "FAQDEF-RES-02 anti-fabrication signal rendered as 'WARNING: Unverified' when not_stated." }
        }
      }
    }
  }
}
