{
  "version": "1.0.0",
  "generated_at": "2026-10-10T14:18:41.767Z",
  "question_count": 18,
  "questions": [
    {
      "id": "q-01",
      "question": "How does Doorstep Rhythm specifically leverage the new Ring developer platform beyond basic event reception to provide its core functionality?",
      "tags": [
        "application_of_technology",
        "ring"
      ],
      "draft_answer": "The project utilizes Ring webhooks (motion_detected with human sub-type, button_press, device_online/offline), backfills with Event History polling, and enriches on demand with WHEP live sessions and image snapshots. It also imports and calls the Ring surface for discovery, status, capabilities, and live sessions.",
      "citations": [
        "winning_project_plan.md:## Executive Pitch",
        "winning_project_plan.md:## AI Solution",
        "winning_project_plan.md:## Why Now",
        "winning_project_plan.md:### Demo Inputs"
      ],
      "source_grounding": "grounded"
    },
    {
      "id": "q-02",
      "question": "How does the project demonstrate a 'documented-integration rule' for the AWS Builder track, specifically with Amazon Bedrock?",
      "tags": [
        "application_of_technology",
        "aws-builder"
      ],
      "draft_answer": "The project uses Amazon Bedrock via the Strands SDK for sort reasoning and rhythm learning. The same Bedrock-powered sort that evidences Tech Implementation also satisfies the AWS Builder documented-integration rule on the identical codebase, maximizing prize EV.",
      "citations": [
        "winning_project_plan.md:## Executive Pitch",
        "winning_project_plan.md:## AI Solution",
        "winning_project_plan.md:## Business Value"
      ],
      "source_grounding": "grounded"
    },
    {
      "id": "q-03",
      "question": "What makes Doorstep Rhythm's approach to caretaking monitoring original compared to existing solutions or simple motion alerts?",
      "tags": [
        "originality"
      ],
      "draft_answer": "It learns a household's irregular rhythm over rolling weeks, explains anomalies in plain language, and uses human-gated nudges. This moves beyond static thresholds or bare live views, addressing the 'creative side' of caretaking monitoring and having no entrenched prior art on Ring.",
      "citations": [
        "winning_project_plan.md:## Executive Pitch",
        "winning_project_plan.md:## Why Now",
        "winning_project_plan.md:## Business Value"
      ],
      "source_grounding": "grounded"
    },
    {
      "id": "q-04",
      "question": "What is the proposed revenue model for Doorstep Rhythm, and how does it address different market segments?",
      "tags": [
        "business_value"
      ],
      "draft_answer": "The revenue model includes a B2C per-household monthly subscription for long-distance adult children and a B2B per-door licensing model for small assisted-living and property-management operators, targeting both individual and institutional care needs.",
      "citations": [
        "winning_project_plan.md:## Business Value"
      ],
      "source_grounding": "grounded"
    },
    {
      "id": "q-05",
      "question": "How does the UI design specifically address the accessibility needs of the target persona's family members, such as the long-distance daughter?",
      "tags": [
        "presentation"
      ],
      "draft_answer": "The product is designed with 'one calm timeline with large-type accessibility and human checkpoints'. This ensures ease of use, clarity, and reduced cognitive load for the long-distance daughter, who needs to quickly discern normal from crisis.",
      "citations": [
        "winning_project_plan.md:## Executive Pitch",
        "winning_project_plan.md:## Architecture"
      ],
      "source_grounding": "grounded"
    },
    {
      "id": "q-06",
      "question": "Describe the agentic workflow and the specific roles of the extractor, planner, and actor models in processing Ring events.",
      "tags": [
        "application_of_technology"
      ],
      "draft_answer": "The extractor (Gemini via Vertex AI) processes webhook batches and history into typed doorstep events. The planner (Gemini via Vertex AI) takes these events and the week model to formulate a sort plan. The actor (Gemini via Vertex AI) then executes the plan by storing actions like notes, flags, clip fetches, or snapshots.",
      "citations": [
        "winning_project_plan.md:### Agentic Workflow & Call Graph"
      ],
      "source_grounding": "grounded"
    },
    {
      "id": "q-07",
      "question": "How does Doorstep Rhythm avoid the 'surveillance' feeling that often deters independent seniors, as mentioned in the problem framing?",
      "tags": [
        "originality",
        "ring"
      ],
      "draft_answer": "It answers from the doorway instead of the phone, turning Ring events into a calm household-rhythm timeline. The system learns what normal looks like and uses human-gated nudges, focusing on gentle monitoring and respecting the senior's autonomy rather than intrusive daily calls.",
      "citations": [
        "winning_project_plan.md:## Executive Pitch",
        "winning_project_plan.md:## Problem Framing",
        "winning_project_plan.md:## Target Persona"
      ],
      "source_grounding": "grounded"
    },
    {
      "id": "q-08",
      "question": "How does the project's focus on the 'long-distance daughter' persona maximize its potential impact and market reach?",
      "tags": [
        "business_value"
      ],
      "draft_answer": "This specific persona is identified as the primary buyer (subscription), a key distributor (recommends to siblings and care circles), and serves as the template for the operator tier (assisted-living doors). This focused approach maximizes market penetration and credible subscription potential.",
      "citations": [
        "winning_project_plan.md:## Target Persona",
        "winning_project_plan.md:## Business Value"
      ],
      "source_grounding": "grounded"
    },
    {
      "id": "q-09",
      "question": "What specific AWS Bedrock capabilities or models are utilized for the 'rhythm learning' aspect of the solution?",
      "tags": [
        "application_of_technology",
        "aws-builder"
      ],
      "draft_answer": "The project states that 'rhythm learning over rolling weeks' occurs 'on Bedrock' and 'sort reasoning on Amazon Bedrock via the Strands SDK'. While specific Bedrock models are not explicitly named, the platform itself is the foundation for these AI capabilities.",
      "citations": [
        "winning_project_plan.md:## Executive Pitch",
        "winning_project_plan.md:## AI Solution"
      ],
      "source_grounding": "grounded"
    },
    {
      "id": "q-10",
      "question": "How will the 'DEMODRIVE-captured golden path with mock-envelope replay' be used to demonstrate the project's functionality during judging?",
      "tags": [
        "presentation"
      ],
      "draft_answer": "The DEMODRIVE-captured golden path with mock-envelope replay provides a reliable, pre-recorded demonstration of the core functionality, ensuring consistent presentation even if live Ring events are unavailable. The video also shows a Playground-token run against simulator events.",
      "citations": [
        "winning_project_plan.md:## Architecture",
        "winning_project_plan.md:### Demo Inputs"
      ],
      "source_grounding": "grounded"
    },
    {
      "id": "q-11",
      "question": "Explain the purpose and function of the 'Truth Engine' within the architecture, and how it interacts with the AI agent.",
      "tags": [
        "application_of_technology"
      ],
      "draft_answer": "The Truth Engine consists of pure functions operating over the week model, producing Issues with severity, entities, human messages, and suggested fixes. It enforces rules like quiet-hours, dwell anomaly, and duplicate suppression. The AI agent calls `check_week_model` after every act batch to repair reported issues.",
      "citations": [
        "winning_project_plan.md:## Architecture",
        "winning_project_plan.md:### Truth Engine"
      ],
      "source_grounding": "grounded"
    },
    {
      "id": "q-12",
      "question": "How does Doorstep Rhythm address the 'early-signal problem' of decline in seniors, as identified in the r/AgingParents evidence?",
      "tags": [
        "originality"
      ],
      "draft_answer": "By learning the household's normal rhythm from ambient Ring events, the system can identify tiny deviations or changes in routine that signal decline long before a crisis, such as unusual quietness or altered patterns of doorstep activity, addressing the 'ambient early signals' problem.",
      "citations": [
        "winning_project_plan.md:## Problem Framing",
        "winning_project_plan.md:## Executive Pitch",
        "winning_project_plan.md:## AI Solution"
      ],
      "source_grounding": "grounded"
    },
    {
      "id": "q-13",
      "question": "Why is AI essential for this solution, and why couldn't it have been built with traditional forms and databases two years ago?",
      "tags": [
        "business_value"
      ],
      "draft_answer": "AI is essential because only an agent holding cross-week state can learn irregular rhythms, separate anomaly from normal, and explain it kindly. Static thresholds fail at this. Furthermore, the Ring developer platform, crucial for the data stream, was not publicly available two years ago.",
      "citations": [
        "winning_project_plan.md:## Why Now",
        "winning_project_plan.md:## Business Value"
      ],
      "source_grounding": "grounded"
    },
    {
      "id": "q-14",
      "question": "The architecture mentions '8 chassis component(s)'. How do these internal components contribute to the project's robustness or development efficiency?",
      "tags": [
        "application_of_technology"
      ],